{
  "schemaVersion": 2,
  "id": "codex",
  "description": "Codex custom-agent and sub-agent translation capabilities.",
  "enforcement": {
    "modelRouting": "native",
    "reasoningEffort": "native",
    "contextInheritance": "native",
    "contextMinimization": "orchestrator",
    "actionAuthority": "native",
    "humanApproval": "native",
    "auditEvidence": "orchestrator",
    "readOnly": "native",
    "delegationDepth": "native",
    "outputTokenLimit": "prompt"
  },
  "reasoningEffortMap": {
    "minimal": "minimal",
    "low": "low",
    "medium": "medium",
    "high": "high",
    "maximum": "max"
  },
  "contextInheritanceMap": {
    "none": "none",
    "recent": "recent-turns",
    "full": "all"
  },
  "notes": [
    "Omit a concrete model from custom-agent configuration to allow current task-aware selection.",
    "Use project or personal custom-agent files to translate profile defaults.",
    "Keep agents.max_depth at one unless recursive delegation is explicitly required.",
    "Resolution assumes the selected approval and permission controls are enabled for the run; runtime configuration must verify that assumption."
  ]
}
